{
  "schemaVersion": "authorization-assessment-authoring/v2",
  "taskId": "memos-get-shared-anonymous",
  "request": "At GetSharedMemo handler entry, can an anonymous caller retrieve the private, active, non-SPACE memo associated with a supplied share token when this task does not say whether the token exists or is unexpired? Assume the associated memo has a valid creator if the token resolves. State the source-visible branches and missing runtime facts.",
  "repository": "https://github.com/usememos/memos",
  "sourceRef": "cb42e326ba9cc266a6a9570c53e0fe04c62793f4",
  "sourceRoot": "../../../authorization-evidence-editing-v1/public-source/memos",
  "sources": [
    "server/api/v1/memo_share_service.go"
  ],
  "policies": {
    "share-token-exact-memo": {
      "text": "GetSharedMemo needs no authentication; a current share token grants access to its exact memo only. Invalid or expired tokens and inaccessible memos yield NOT_FOUND.",
      "location": "proto/api/v1/memo_service.proto:134-138; server/api/v1/memo_share_service.go:170-213",
      "revision": "cb42e326ba9cc266a6a9570c53e0fe04c62793f4",
      "acceptance": "accepted",
      "reason": "Public fixed-ref source and task-author bounded requirement."
    }
  },
  "principals": {
    "anonymous-token-holder": {
      "role": "anonymous caller presenting an unspecified share token",
      "facts": [
        "The caller is not authenticated.",
        "Token existence and expiry are not supplied as facts."
      ]
    }
  },
  "resources": {
    "private-memo": {
      "type": "memo",
      "facts": [
        "If the token resolves, its associated memo is active, private, non-SPACE, and has a valid creator.",
        "There is no separately named memo identifier in GetSharedMemoRequest."
      ]
    }
  },
  "entries": {
    "get-shared": {
      "name": "GetSharedMemo",
      "locations": [
        {
          "path": "server/api/v1/memo_share_service.go",
          "startLine": 170,
          "endLine": 213
        }
      ]
    }
  },
  "scenarios": {
    "token-status-unspecified": {
      "principal": "anonymous-token-holder",
      "resource": "private-memo",
      "policy": "share-token-exact-memo",
      "entries": [
        "get-shared"
      ],
      "relation": "anonymous-token-validity-unknown",
      "operation": "retrieve token-associated memo",
      "expectation": "conditional"
    }
  },
  "additionalQuestions": [
    "identify the principal, operation, protected resource, decisive control, and effect",
    "return source_supported_failure, source_refuted, or unknown with exact supplied-source locations"
  ],
  "additionalConstraints": [
    "Use only the supplied fixed-ref case inputs.",
    "Do not execute the target project or infer deployment facts."
  ],
  "analysisContract": {
    "schemaVersion": "authorization-analysis-contract/v1",
    "publicInstruction": "Decide the current scenario at the stated declared-entry boundary from the supplied fixed source and accepted policy. Treat premises as question assumptions, not source or deployment proof. Trace the decisive authorization control, protected object and effect with exact supplied-source locations. State any decisive missing runtime fact rather than assuming it. Do not execute the target, infer missing deployment facts, or consult later versions.\nCurrent question: At GetSharedMemo handler entry, can an anonymous caller retrieve the private, active, non-SPACE memo associated with a supplied share token when this task does not say whether the token exists or is unexpired? Assume the associated memo has a valid creator if the token resolves. State the source-visible branches and missing runtime facts.\nAnalysis boundary: declared-entry.\nTask premise: At GetSharedMemo entry, the caller is anonymous. If the token resolves, its associated memo is active, private, non-SPACE, and has a valid creator. Token existence and expiry are unspecified.\nRequired response detail: Explain the valid token-associated memo and invalid/expired branches; do not invent token state, a separate requested memo identity, or deployment success.",
    "scenarios": {
      "token-status-unspecified": {
        "boundary": "declared-entry",
        "premises": [
          {
            "id": "premise-1",
            "statement": "At GetSharedMemo entry, the caller is anonymous. If the token resolves, its associated memo is active, private, non-SPACE, and has a valid creator. Token existence and expiry are unspecified.",
            "atEntry": "get-shared",
            "provenance": "task-assumption"
          }
        ],
        "requestedBranches": [],
        "requiredResponseDetails": [
          "Explain the valid token-associated memo and invalid/expired branches; do not invent token state, a separate requested memo identity, or deployment success."
        ]
      }
    }
  }
}
